{
  "schemaVersion": 1,
  "taskId": "T-007",
  "entries": [
    {
      "type": "test-output",
      "command": "npm test",
      "result": "12 tests passed",
      "capturedAt": "2026-09-21T09:36:46.105Z",
      "artifactPath": null,
      "sha256": null
    },
    {
      "type": "manual-acceptance",
      "command": "git ls-remote origin refs/heads/main",
      "result": "远端 main 与本地 HEAD 均为 99f6d3345285995751124ed40e5613b5d8c582dc",
      "capturedAt": "2026-09-21T09:36:46.173Z",
      "artifactPath": null,
      "sha256": null
    },
    {
      "type": "commit",
      "command": "git push -u origin main",
      "result": "已推送到 origin/main",
      "capturedAt": "2026-09-21T09:36:46.231Z",
      "artifactPath": null,
      "sha256": null
    }
  ],
  "updatedAt": "2026-09-21T09:36:46.232Z"
}
